{
  "version": "foundation-v1",
  "architecture_status": "FROZEN",
  "p00_exit_status": "VERIFICATION",
  "frozen_packages": ["P00.01", "P00.02", "P00.03", "P00.04", "P00.05", "P00.06", "P00.07", "P00.08", "P00.09"],
  "p01_entry_gate": {
    "state": "BLOCKED",
    "kernel_code_authorized": false,
    "business_feature_code_authorized": false,
    "blockers": [
      {
        "id": "EG-02",
        "tracker": "issue:#3",
        "state": "BLOCKED",
        "description": "main branch/ruleset protection is not applied and verified"
      },
      {
        "id": "EG-03",
        "tracker": "issue:#14",
        "state": "SATISFIED",
        "description": "local Windows self-hosted executable CI lane verified by workflow run 32522919774 on LOCAL-WIN-01"
      }
    ]
  },
  "external_distribution_gate": {
    "state": "BLOCKED",
    "tracker": "issue:#4",
    "description": "licensing/IP/trademark strategy requires explicit owner/legal decision before external distribution/public launch"
  }
}